GeneID,UniProtID,GeneName,Family_subfamily,ProteinClass,GO_MF,GO_BO,GO_CC
SORBI_3001G055700,C5WX58,DNA (cytosine-5)-methyltransferase,DNA (CYTOSINE-5)-METHYLTRANSFERASE 1A (PTHR10629:SF60),DNA methyltransferase(PC00013),DNA binding(GO:0003677);chromatin binding(GO:0003682);DNA (cytosine-5-)-methyltransferase activity(GO:0003886);methyltransferase activity(GO:0008168);transferase activity(GO:0016740),DNA methylation-dependent constitutive heterochromatin formation(GO:0006346);methylation(GO:0032259);negative regulation of gene expression via chromosomal CpG island methylation(GO:0044027),nucleus(GO:0005634)
SORBI_3002G374400,A0A1B6QFJ9,Erect panicle 2 protein,GPI-ANCHORED ADHESIN-LIKE PROTEIN (PTHR31008:SF15),,,,
SORBI_3009G043800,C5Z028,NAD-dependent epimerase_dehydratase domain-containing protein,DIHYDROFLAVONOL 4-REDUCTASE (PTHR10366:SF720),dehydratase(PC00091),"oxidoreductase activity(GO:0016491);oxidoreductase activity, acting on the CH-OH group of donors, NAD or NADP as acceptor(GO:0016616)",,
SORBI_3001G173800,C5WT96,Nucleolar protein 14,NUCLEOLAR PROTEIN 14 (PTHR23183:SF0),RNA metabolism protein(PC00031),,rRNA processing(GO:0006364);maturation of SSU-rRNA(GO:0030490);ribosome biogenesis(GO:0042254),nucleus(GO:0005634);nucleolus(GO:0005730);Noc4p-Nop14p complex(GO:0030692);small-subunit processome(GO:0032040)
SORBI_3003G364600,C5XQJ5,"Glucan endo-1,3-beta-D-glucosidase",OS01G0860800 PROTEIN (PTHR32227:SF71),glucosidase(PC00108),"hydrolase activity, hydrolyzing O-glycosyl compounds(GO:0004553);hydrolase activity(GO:0016787);hydrolase activity, acting on glycosyl bonds(GO:0016798)",carbohydrate metabolic process(GO:0005975),plasma membrane(GO:0005886)
SORBI_3001G115400,A0A1Z5S5B7,Protein kinase domain-containing protein,MITOGEN-ACTIVATED PROTEIN KINASE KINASE 7-RELATED (PTHR24361:SF769),non-receptor serine/threonine protein kinase(PC00167),nucleotide binding(GO:0000166);protein kinase activity(GO:0004672);protein serine/threonine kinase activity(GO:0004674);MAP kinase kinase activity(GO:0004708);ATP binding(GO:0005524);kinase activity(GO:0016301);transferase activity(GO:0016740),MAPK cascade(GO:0000165);response to other organism(GO:0051707),cytoplasm(GO:0005737)
SORBI_3002G114100,A0A109NDH1,Zinc finger GRF-type domain-containing protein,,,,,
SORBI_3004G105100,C5XYY5,Peroxidase,PEROXIDASE (PTHR31388:SF285),peroxidase(PC00180),peroxidase activity(GO:0004601);oxidoreductase activity(GO:0016491);heme binding(GO:0020037);metal ion binding(GO:0046872);lactoperoxidase activity(GO:0140825),response to oxidative stress(GO:0006979);hydrogen peroxide catabolic process(GO:0042744);cellular oxidant detoxification(GO:0098869),extracellular region(GO:0005576)
SORBI_3010G229600,C5Z7U8,Vacuolar ATPase assembly integral membrane protein VMA21 homolog,VACUOLAR ATPASE ASSEMBLY INTEGRAL MEMBRANE PROTEIN VMA21 (PTHR31792:SF3),,,vacuolar proton-transporting V-type ATPase complex assembly(GO:0070072),endoplasmic reticulum(GO:0005783);endoplasmic reticulum membrane(GO:0005789);ER to Golgi transport vesicle membrane(GO:0012507);membrane(GO:0016020);cytoplasmic vesicle(GO:0031410);endoplasmic reticulum-Golgi intermediate compartment membrane(GO:0033116)
SORBI_3009G026850,A0A1Z5R0J5,Uncharacterized protein,,,,,